body,category,communityName,createdAt,dataType,description,flair,html,id,isAd,isVideo,numberOfComments,numberOfreplies,over18,parentId,parsedCommunityName,parsedId,postId,scrapedAt,thumbnailUrl,title,upVoteRatio,upVotes,url,userIcon,userId,username,videoUrl
,,,2020-12-25T10:05:46.000Z,user,fuck israel fuck palestine,,,9hoyx9ic,,,,,FALSE,,,,,2024-06-18T15:16:41.800Z,,,,,https://www.reddit.com/user/Frost_boi/,https://i.redd.it/snoovatar/avatars/1ff35ee1-121b-4e2c-b414-8014490aebe2-headshot.png,,Frost_boi,
,,,2021-02-01T20:45:28.000Z,user,i hate a levels,,,8qr8j0iq,,,,,FALSE,,,,,2024-06-18T15:16:41.846Z,,,,,https://www.reddit.com/user/420koolaidman/,https://styles.redditmedia.com/t5_3vnvw8/styles/profileIcon_snoof695a60d-59f8-4d73-8046-dc946456a5fb-headshot.png,,420koolaidman,
"URL: https://v.redd.it/qetvjinh7zsb1
Thumbnail: nsfw
Images:
	https://external-preview.redd.it/MzY0MjgzaGg3enNiMawVdb6yP69J4RIEzxneF8Uv37tQl6L6Ji5iPEeBAHGT.png?format=pjpg&amp;auto=webp&amp;s=8fab42b2f9adde6de543fc5399d3036381f7cfaf
",,r/TikTokCringe,2023-10-08T12:55:20.000Z,post,,Discussion,,t3_172yh7w,FALSE,TRUE,1243,,TRUE,,TikTokCringe,172yh7w,,2024-06-18T15:16:46.873Z,nsfw,Having a nuanced view of the Israel Palestine conflict,0.83,6284,https://www.reddit.com/r/TikTokCringe/comments/172yh7w/having_a_nuanced_view_of_the_israel_palestine/,,t2_geo60,BryanAbbo,https://v.redd.it/qetvjinh7zsb1/DASH_480.mp4?source=fallback
"For the past decade or so I have typically supported Palestine fighting for it's right to having a homeland. However, I just watched about 30 videos of events that took place today. What I saw was not people fighting for their homeland but people murdering, desecrating corpses innocent people. This is terrorism, plain and simple. In a couple instances it was Israeli soldiers which is at least not innocent civilians but the way they treated their bodies and paraded them and stomped on them is disgusting. I can now see why Israel needs to defend itself and it's people. I don't think they should be bombing equally innocent people on the Palestine side but I can see why they should defend themselves because the things I saw today we're revolting and horrific. I still think both sides should still strive to find peace but I am not sure if this is even possible after today's acts. Hamas likely will need to be eradicated and eliminated, vile people.

Has anyone else changed their mind, either way?",,r/IsraelPalestine,2023-10-08T10:51:36.000Z,post,,2023.10.7 Hamas Operation Al-Aqsa Flood/IDF Iron Swords War,"&lt;!-- SC_OFF --&gt;&lt;div class=""md""&gt;&lt;p&gt;For the past decade or so I have typically supported Palestine fighting for it&amp;#39;s right to having a homeland. However, I just watched about 30 videos of events that took place today. What I saw was not people fighting for their homeland but people murdering, desecrating corpses innocent people. This is terrorism, plain and simple. In a couple instances it was Israeli soldiers which is at least not innocent civilians but the way they treated their bodies and paraded them and stomped on them is disgusting. I can now see why Israel needs to defend itself and it&amp;#39;s people. I don&amp;#39;t think they should be bombing equally innocent people on the Palestine side but I can see why they should defend themselves because the things I saw today we&amp;#39;re revolting and horrific. I still think both sides should still strive to find peace but I am not sure if this is even possible after today&amp;#39;s acts. Hamas likely will need to be eradicated and eliminated, vile people.&lt;/p&gt;

&lt;p&gt;Has anyone else changed their mind, either way?&lt;/p&gt;
&lt;/div&gt;&lt;!-- SC_ON --&gt;",t3_172w9gt,FALSE,FALSE,2799,,FALSE,,IsraelPalestine,172w9gt,,2024-06-18T15:16:47.675Z,self,I have changed my mind about the Israel-Palestine conflict. Have you?,0.67,4886,https://www.reddit.com/r/IsraelPalestine/comments/172w9gt/i_have_changed_my_mind_about_the_israelpalestine/,,t2_a8375x5n,Buy_Ether,
Both claim to be the descendants of Abraham though.  So wouldn’t that mean it’s plausible they’ve both been there and lived amongst each other.   I’m not a historian though.  Perhaps someone else could chime in.,TikTokCringe,r/TikTokCringe,2023-10-08T14:58:09.000Z,comment,,,"&lt;div class=""md""&gt;&lt;p&gt;Both claim to be the descendants of Abraham though.  So wouldn’t that mean it’s plausible they’ve both been there and lived amongst each other.   I’m not a historian though.  Perhaps someone else could chime in.&lt;/p&gt;
&lt;/div&gt;",t1_k3zup0l,,,,3,,t1_k3zrr1j,,k3zup0l,t3_172yh7w,2024-06-18T15:16:53.558Z,,,,5,https://www.reddit.com/r/TikTokCringe/comments/172yh7w/having_a_nuanced_view_of_the_israel_palestine/k3zup0l/,,t2_3q7hyl88,notasuccessstory,
"If that’s the case, then his Native American comment makes zero sense.",TikTokCringe,r/TikTokCringe,2023-10-08T15:24:04.000Z,comment,,,"&lt;div class=""md""&gt;&lt;p&gt;If that’s the case, then his Native American comment makes zero sense.&lt;/p&gt;
&lt;/div&gt;",t1_k3zyoxz,,,,1,,t1_k3zup0l,,k3zyoxz,t3_172yh7w,2024-06-18T15:16:53.558Z,,,,23,https://www.reddit.com/r/TikTokCringe/comments/172yh7w/having_a_nuanced_view_of_the_israel_palestine/k3zyoxz/,,t2_2d21vjih,SeniorWilson44,
"May not be the best analogy but racism kept Jews from finding new homes and starting a new beginning after the war in other countries.  I think the “well we don’t want them here” racist mentality is a large part responsible for this meaningless loss of human life.  

https://en.wikipedia.org/wiki/Mandate_for_Palestine",TikTokCringe,r/TikTokCringe,2023-10-08T15:51:16.000Z,comment,,,"&lt;div class=""md""&gt;&lt;p&gt;May not be the best analogy but racism kept Jews from finding new homes and starting a new beginning after the war in other countries.  I think the “well we don’t want them here” racist mentality is a large part responsible for this meaningless loss of human life.  &lt;/p&gt;

&lt;p&gt;&lt;a href=""https://en.wikipedia.org/wiki/Mandate_for_Palestine""&gt;https://en.wikipedia.org/wiki/Mandate_for_Palestine&lt;/a&gt;&lt;/p&gt;
&lt;/div&gt;",t1_k40319s,,,,0,,t1_k3zyoxz,,k40319s,t3_172yh7w,2024-06-18T15:16:53.558Z,,,,4,https://www.reddit.com/r/TikTokCringe/comments/172yh7w/having_a_nuanced_view_of_the_israel_palestine/k40319s/,,t2_3q7hyl88,notasuccessstory,
"The jews don't ""claim' from a magic book though, most jews aren't even Jewish, its bit a religion it's a tribe/ethnicity.

You can literally just read about the judeo Roman Wars, we've been fighting colonialism for a long time.

https://en.m.wikipedia.org/wiki/Jewish%E2%80%93Roman_wars",TikTokCringe,r/TikTokCringe,2023-10-08T15:51:00.000Z,comment,,,"&lt;div class=""md""&gt;&lt;p&gt;The jews don&amp;#39;t &amp;quot;claim&amp;#39; from a magic book though, most jews aren&amp;#39;t even Jewish, its bit a religion it&amp;#39;s a tribe/ethnicity.&lt;/p&gt;

&lt;p&gt;You can literally just read about the judeo Roman Wars, we&amp;#39;ve been fighting colonialism for a long time.&lt;/p&gt;

&lt;p&gt;&lt;a href=""https://en.m.wikipedia.org/wiki/Jewish%E2%80%93Roman_wars""&gt;https://en.m.wikipedia.org/wiki/Jewish%E2%80%93Roman_wars&lt;/a&gt;&lt;/p&gt;
&lt;/div&gt;",t1_k402zso,,,,0,,t1_k3zup0l,,k402zso,t3_172yh7w,2024-06-18T15:16:53.558Z,,,,7,https://www.reddit.com/r/TikTokCringe/comments/172yh7w/having_a_nuanced_view_of_the_israel_palestine/k402zso/,,t2_al4bi,SirRece,
Maybe Palestinians are descendants of Jews that were converted over time.,TikTokCringe,r/TikTokCringe,2023-10-08T16:18:44.000Z,comment,,,"&lt;div class=""md""&gt;&lt;p&gt;Maybe Palestinians are descendants of Jews that were converted over time.&lt;/p&gt;
&lt;/div&gt;",t1_k407kre,,,,0,,t1_k3zup0l,,k407kre,t3_172yh7w,2024-06-18T15:16:53.558Z,,,,4,https://www.reddit.com/r/TikTokCringe/comments/172yh7w/having_a_nuanced_view_of_the_israel_palestine/k407kre/,,t2_4a2w0o5t,thekingminn,
"your underestimating the cruelty of the middle eastern culture during conflicts. 
Its not ""orientalized and exoticized"". It is what it is and its as ""simple"" as that: brake into civiliian homes and shoot whole families in their beds, a massacre in an ambush planned beforehend for thousands people dancing at a festival. Kidnapping civillians! Including babies and old people. It is simply just some ISIS level things. Orientalized? Thats just pure evil. Nobody should act like a monster doesnt matter how he was treated before.",TikTokCringe,r/TikTokCringe,2023-10-08T23:12:46.000Z,comment,,,"&lt;div class=""md""&gt;&lt;p&gt;your underestimating the cruelty of the middle eastern culture during conflicts. 
Its not &amp;quot;orientalized and exoticized&amp;quot;. It is what it is and its as &amp;quot;simple&amp;quot; as that: brake into civiliian homes and shoot whole families in their beds, a massacre in an ambush planned beforehend for thousands people dancing at a festival. Kidnapping civillians! Including babies and old people. It is simply just some ISIS level things. Orientalized? Thats just pure evil. Nobody should act like a monster doesnt matter how he was treated before.&lt;/p&gt;
&lt;/div&gt;",t1_k4239od,,,,0,,t3_172yh7w,,k4239od,t3_172yh7w,2024-06-18T15:16:54.731Z,,,,0,https://www.reddit.com/r/TikTokCringe/comments/172yh7w/having_a_nuanced_view_of_the_israel_palestine/k4239od/,,t2_4x387w41,Desperate-Toe-922,
So Israel has been kissing Palestinians for decades?,IsraelPalestine,r/IsraelPalestine,2023-10-08T18:34:43.000Z,comment,,,"&lt;div class=""md""&gt;&lt;p&gt;So Israel has been kissing Palestinians for decades?&lt;/p&gt;
&lt;/div&gt;",t1_k40uucw,,,,2,,t3_172w9gt,,k40uucw,t3_172w9gt,2024-06-18T15:16:55.757Z,,,,0,https://www.reddit.com/r/IsraelPalestine/comments/172w9gt/i_have_changed_my_mind_about_the_israelpalestine/k40uucw/,,,[deleted],
Surely you meant killing?,IsraelPalestine,r/IsraelPalestine,2023-10-08T19:04:50.000Z,comment,,,"&lt;div class=""md""&gt;&lt;p&gt;Surely you meant killing?&lt;/p&gt;
&lt;/div&gt;",t1_k40zz39,,,,0,,t1_k40uucw,,k40zz39,t3_172w9gt,2024-06-18T15:16:55.757Z,,,,1,https://www.reddit.com/r/IsraelPalestine/comments/172w9gt/i_have_changed_my_mind_about_the_israelpalestine/k40zz39/,,t2_12rgpb,Koth87,
Israel must be a terrible kisser if Palestine is this upset.,IsraelPalestine,r/IsraelPalestine,2023-10-08T18:41:16.000Z,comment,,,"&lt;div class=""md""&gt;&lt;p&gt;Israel must be a terrible kisser if Palestine is this upset.&lt;/p&gt;
&lt;/div&gt;",t1_k40vyib,,,,1,,t1_k40uucw,,k40vyib,t3_172w9gt,2024-06-18T15:16:55.757Z,,,,1,https://www.reddit.com/r/IsraelPalestine/comments/172w9gt/i_have_changed_my_mind_about_the_israelpalestine/k40vyib/,,t2_h4rcdziz,AgileArtichokes,
I'm not taking a side because both sides have committed unforgivable acts of violence. Rather than choosing sides how can we make it known that violence against any woman and child is unacceptable +? Rape is never acceptable,IsraelPalestine,r/IsraelPalestine,2023-10-08T18:55:40.000Z,comment,,,"&lt;div class=""md""&gt;&lt;p&gt;I&amp;#39;m not taking a side because both sides have committed unforgivable acts of violence. Rather than choosing sides how can we make it known that violence against any woman and child is unacceptable +? Rape is never acceptable&lt;/p&gt;
&lt;/div&gt;",t1_k40yeuj,,,,0,,t1_k40vyib,,k40yeuj,t3_172w9gt,2024-06-18T15:16:55.757Z,,,,1,https://www.reddit.com/r/IsraelPalestine/comments/172w9gt/i_have_changed_my_mind_about_the_israelpalestine/k40yeuj/,,,[deleted],
"Cringe! This kid doesn't know the first thing about the history of Israel.

This kid is projecting his own Country's Colonization of  4 continents as well as in Afria, India, The Americas, Australia etc. onto Israel.  

50% 0f the palestinian population, including people who claim to be palestinians across the world, are all descendants from Immigrants to Palestinia- Sriyana between  1880-1948 (BBC)

They came to work for the Jewish community in Palestinia- Sriyana ( Is today called israel)",TikTokCringe,r/TikTokCringe,2023-10-14T07:25:44.000Z,comment,,,"&lt;div class=""md""&gt;&lt;p&gt;Cringe! This kid doesn&amp;#39;t know the first thing about the history of Israel.&lt;/p&gt;

&lt;p&gt;This kid is projecting his own Country&amp;#39;s Colonization of  4 continents as well as in Afria, India, The Americas, Australia etc. onto Israel.  &lt;/p&gt;

&lt;p&gt;50% 0f the palestinian population, including people who claim to be palestinians across the world, are all descendants from Immigrants to Palestinia- Sriyana between  1880-1948 (BBC)&lt;/p&gt;

&lt;p&gt;They came to work for the Jewish community in Palestinia- Sriyana ( Is today called israel)&lt;/p&gt;
&lt;/div&gt;",t1_k4td8c4,,,,0,,t3_172yh7w,,k4td8c4,t3_172yh7w,2024-06-18T15:16:56.344Z,,,,1,https://www.reddit.com/r/TikTokCringe/comments/172yh7w/having_a_nuanced_view_of_the_israel_palestine/k4td8c4/,,t2_7262opwg,United_Bid_5274,
"While the surface level conflicts are about land and resources, they are fueled by religious dogma. The leadership are warring over physical things but the source of conflict over THIS PARTICULAR strip of land is never going away. There is no solution because the fervor supercedes any rational concerns. It will never end, even when this round is over. So it doesn't feel great supporting anyway, knowing any halt in bloodshed will only ever be temporary.",IsraelPalestine,r/IsraelPalestine,2023-10-08T19:15:51.000Z,comment,,,"&lt;div class=""md""&gt;&lt;p&gt;While the surface level conflicts are about land and resources, they are fueled by religious dogma. The leadership are warring over physical things but the source of conflict over THIS PARTICULAR strip of land is never going away. There is no solution because the fervor supercedes any rational concerns. It will never end, even when this round is over. So it doesn&amp;#39;t feel great supporting anyway, knowing any halt in bloodshed will only ever be temporary.&lt;/p&gt;
&lt;/div&gt;",t1_k411tss,,,,0,,t3_172w9gt,,k411tss,t3_172w9gt,2024-06-18T15:16:57.648Z,,,,1,https://www.reddit.com/r/IsraelPalestine/comments/172w9gt/i_have_changed_my_mind_about_the_israelpalestine/k411tss/,,t2_3h583q96,ARadioAndAWindow,
"
**Welcome to r/TikTokCringe!**

 This is a message directed to all newcomers to make you aware that r/TikTokCringe evolved long ago from only cringe-worthy content to TikToks of all kinds! If you’re looking to find only the cringe-worthy TikToks on this subreddit (which are still regularly posted) we recommend sorting by flair which you can do [here](https://www.reddit.com/r/TikTokCringe/comments/galuit/click_here_to_sort_by_flair_a_guide_to_using/) (Currently supported by desktop and reddit mobile). 

 See someone asking how this post is cringe because they didn't read this comment? Show them [this!](https://www.reddit.com/r/TikTokCringe/comments/fyrgzy/for_those_confused_by_the_name_of_this_subreddit/)
    
 Be sure to read the rules of this subreddit before posting or commenting. Thanks!

 **Don't forget to join our [Discord server](https://discord.gg/cringekingdom)!**
 
 ##**[CLICK HERE TO DOWNLOAD THIS VIDEO](https://rapidsave.com/info?url=https://www.reddit.com/r/TikTokCringe/comments/172yh7w/having_a_nuanced_view_of_the_israel_palestine/)**

*I am a bot, and this action was performed automatically. Please [contact the moderators of this subreddit](/message/compose/?to=/r/TikTokCringe) if you have any questions or concerns.*",TikTokCringe,r/TikTokCringe,2023-10-08T12:55:43.000Z,comment,,,"&lt;div class=""md""&gt;&lt;p&gt;&lt;strong&gt;Welcome to &lt;a href=""/r/TikTokCringe""&gt;r/TikTokCringe&lt;/a&gt;!&lt;/strong&gt;&lt;/p&gt;

&lt;p&gt;This is a message directed to all newcomers to make you aware that &lt;a href=""/r/TikTokCringe""&gt;r/TikTokCringe&lt;/a&gt; evolved long ago from only cringe-worthy content to TikToks of all kinds! If you’re looking to find only the cringe-worthy TikToks on this subreddit (which are still regularly posted) we recommend sorting by flair which you can do &lt;a href=""https://www.reddit.com/r/TikTokCringe/comments/galuit/click_here_to_sort_by_flair_a_guide_to_using/""&gt;here&lt;/a&gt; (Currently supported by desktop and reddit mobile). &lt;/p&gt;

&lt;p&gt;See someone asking how this post is cringe because they didn&amp;#39;t read this comment? Show them &lt;a href=""https://www.reddit.com/r/TikTokCringe/comments/fyrgzy/for_those_confused_by_the_name_of_this_subreddit/""&gt;this!&lt;/a&gt;&lt;/p&gt;

&lt;p&gt;Be sure to read the rules of this subreddit before posting or commenting. Thanks!&lt;/p&gt;

&lt;p&gt;&lt;strong&gt;Don&amp;#39;t forget to join our &lt;a href=""https://discord.gg/cringekingdom""&gt;Discord server&lt;/a&gt;!&lt;/strong&gt;&lt;/p&gt;

&lt;p&gt;##&lt;strong&gt;&lt;a href=""https://rapidsave.com/info?url=https://www.reddit.com/r/TikTokCringe/comments/172yh7w/having_a_nuanced_view_of_the_israel_palestine/""&gt;CLICK HERE TO DOWNLOAD THIS VIDEO&lt;/a&gt;&lt;/strong&gt;&lt;/p&gt;

&lt;p&gt;&lt;em&gt;I am a bot, and this action was performed automatically. Please &lt;a href=""/message/compose/?to=/r/TikTokCringe""&gt;contact the moderators of this subreddit&lt;/a&gt; if you have any questions or concerns.&lt;/em&gt;&lt;/p&gt;
&lt;/div&gt;",t1_k3zdmo1,,,,0,,t3_172yh7w,,k3zdmo1,t3_172yh7w,2024-06-18T15:16:46.938Z,,,,1,https://www.reddit.com/r/TikTokCringe/comments/172yh7w/having_a_nuanced_view_of_the_israel_palestine/k3zdmo1/,,t2_6l4z3,AutoModerator,
This would've gone hard with a Subway Surfers speedrun.,TikTokCringe,r/TikTokCringe,2023-10-08T15:49:20.000Z,comment,,,"&lt;div class=""md""&gt;&lt;p&gt;This would&amp;#39;ve gone hard with a Subway Surfers speedrun.&lt;/p&gt;
&lt;/div&gt;",t1_k402q63,,,,5,,t3_172yh7w,,k402q63,t3_172yh7w,2024-06-18T15:16:46.938Z,,,,1109,https://www.reddit.com/r/TikTokCringe/comments/172yh7w/having_a_nuanced_view_of_the_israel_palestine/k402q63/,,t2_150kcg,romanianfish,
Dude is such a good orator that I watched it entirely (and my attention span is shit),TikTokCringe,r/TikTokCringe,2023-10-08T23:23:08.000Z,comment,,,"&lt;div class=""md""&gt;&lt;p&gt;Dude is such a good orator that I watched it entirely (and my attention span is shit)&lt;/p&gt;
&lt;/div&gt;",t1_k424swo,,,,2,,t1_k402q63,,k424swo,t3_172yh7w,2024-06-18T15:16:46.938Z,,,,127,https://www.reddit.com/r/TikTokCringe/comments/172yh7w/having_a_nuanced_view_of_the_israel_palestine/k424swo/,,t2_81zpisib,teki4s,
Same.,TikTokCringe,r/TikTokCringe,2023-10-09T02:36:15.000Z,comment,,,"&lt;div class=""md""&gt;&lt;p&gt;Same.&lt;/p&gt;
&lt;/div&gt;",t1_k42veqh,,,,0,,t1_k424swo,,k42veqh,t3_172yh7w,2024-06-18T15:16:46.938Z,,,,14,https://www.reddit.com/r/TikTokCringe/comments/172yh7w/having_a_nuanced_view_of_the_israel_palestine/k42veqh/,,t2_5sw0bbzl,Hopeforus1402,
Lmaooo,TikTokCringe,r/TikTokCringe,2023-10-08T16:34:06.000Z,comment,,,"&lt;div class=""md""&gt;&lt;p&gt;Lmaooo&lt;/p&gt;
&lt;/div&gt;",t1_k40a652,,,,1,,t1_k402q63,,k40a652,t3_172yh7w,2024-06-18T15:16:46.938Z,,,,105,https://www.reddit.com/r/TikTokCringe/comments/172yh7w/having_a_nuanced_view_of_the_israel_palestine/k40a652/,,t2_geo60,BryanAbbo,
"Take my upvote, please. Raise subway surfers for truck simulator, but that’s probably too on the nose..",TikTokCringe,r/TikTokCringe,2023-10-08T21:05:21.000Z,comment,,,"&lt;div class=""md""&gt;&lt;p&gt;Take my upvote, please. Raise subway surfers for truck simulator, but that’s probably too on the nose..&lt;/p&gt;
&lt;/div&gt;",t1_k41k54c,,,,0,,t1_k402q63,,k41k54c,t3_172yh7w,2024-06-18T15:16:46.938Z,,,,11,https://www.reddit.com/r/TikTokCringe/comments/172yh7w/having_a_nuanced_view_of_the_israel_palestine/k41k54c/,,t2_uby4e,ShawnTomahawk,
I prefer the poorly executed GTA car jumps personally.,TikTokCringe,r/TikTokCringe,2023-10-08T21:40:55.000Z,comment,,,"&lt;div class=""md""&gt;&lt;p&gt;I prefer the poorly executed GTA car jumps personally.&lt;/p&gt;
&lt;/div&gt;",t1_k41ps76,,,,0,,t1_k402q63,,k41ps76,t3_172yh7w,2024-06-18T15:16:46.938Z,,,,5,https://www.reddit.com/r/TikTokCringe/comments/172yh7w/having_a_nuanced_view_of_the_israel_palestine/k41ps76/,,t2_c52pfp9y,SuplexedYaNan,
But going back to 1967 borders and ending the occupation won’t end anything.,TikTokCringe,r/TikTokCringe,2023-10-08T16:36:26.000Z,comment,,,"&lt;div class=""md""&gt;&lt;p&gt;But going back to 1967 borders and ending the occupation won’t end anything.&lt;/p&gt;
&lt;/div&gt;",t1_k40ak9r,,,,5,,t3_172yh7w,,k40ak9r,t3_172yh7w,2024-06-18T15:16:46.938Z,,,,413,https://www.reddit.com/r/TikTokCringe/comments/172yh7w/having_a_nuanced_view_of_the_israel_palestine/k40ak9r/,,t2_gojdmgb9,Neekovo,
I actually disagree with him and agree with you on this. But it’s where a lot of people think the first steps towards peace may lie and it’s where people think that at least less death and suffering will be involved. So while I don’t think it’s the best option. I think it might help Palestinians who are currently living in a very hard situation.,TikTokCringe,r/TikTokCringe,2023-10-08T16:38:11.000Z,comment,,,"&lt;div class=""md""&gt;&lt;p&gt;I actually disagree with him and agree with you on this. But it’s where a lot of people think the first steps towards peace may lie and it’s where people think that at least less death and suffering will be involved. So while I don’t think it’s the best option. I think it might help Palestinians who are currently living in a very hard situation.&lt;/p&gt;
&lt;/div&gt;",t1_k40auvf,,,,2,,t1_k40ak9r,,k40auvf,t3_172yh7w,2024-06-18T15:16:46.938Z,,,,222,https://www.reddit.com/r/TikTokCringe/comments/172yh7w/having_a_nuanced_view_of_the_israel_palestine/k40auvf/,,t2_geo60,BryanAbbo,
"A big issue is that this current war is pointless as fuck. Isreal isnt gonna lose by force, they can easily outlast hamas and starve out the whole of palestina. Hell they are already doing it. So that means that all changes have to come from diplomatic shit. Or atleast give Isreal a proper other option.

Because currently if Isreal consedeces than they ensure that Hamas will always rule palestina meaning they create a legitemate souvering enemy state right of their border, something that not even the most progressive, leftleaning pacafist Isrealian would see as a viable option.

So yeah its might be a form of colonialisme and all that shit but unlike other colonial conflicts Isreal is fighting on their home groun for their continued survival. They dont have the logistical issues that european powers had in the 60s, they dont have the moral issue that their citizens dont want to fight some poor villager on rhe other side of the globe. 

Every colonial conflict was won by the natives not because they had superior millitary power but because colonial occupation became to expensive economically, morally and diplomaticly. For Isreal it will never come to that point.",TikTokCringe,r/TikTokCringe,2023-10-09T14:49:18.000Z,comment,,,"&lt;div class=""md""&gt;&lt;p&gt;A big issue is that this current war is pointless as fuck. Isreal isnt gonna lose by force, they can easily outlast hamas and starve out the whole of palestina. Hell they are already doing it. So that means that all changes have to come from diplomatic shit. Or atleast give Isreal a proper other option.&lt;/p&gt;

&lt;p&gt;Because currently if Isreal consedeces than they ensure that Hamas will always rule palestina meaning they create a legitemate souvering enemy state right of their border, something that not even the most progressive, leftleaning pacafist Isrealian would see as a viable option.&lt;/p&gt;

&lt;p&gt;So yeah its might be a form of colonialisme and all that shit but unlike other colonial conflicts Isreal is fighting on their home groun for their continued survival. They dont have the logistical issues that european powers had in the 60s, they dont have the moral issue that their citizens dont want to fight some poor villager on rhe other side of the globe. &lt;/p&gt;

&lt;p&gt;Every colonial conflict was won by the natives not because they had superior millitary power but because colonial occupation became to expensive economically, morally and diplomaticly. For Isreal it will never come to that point.&lt;/p&gt;
&lt;/div&gt;",t1_k44xm9b,,,,2,,t1_k40auvf,,k44xm9b,t3_172yh7w,2024-06-18T15:16:46.938Z,,,,16,https://www.reddit.com/r/TikTokCringe/comments/172yh7w/having_a_nuanced_view_of_the_israel_palestine/k44xm9b/,,t2_73642sfy,kelldricked,
The Palestinians are colonists who stayed long enough for people to forget they are colonists,TikTokCringe,r/TikTokCringe,2023-10-13T17:40:42.000Z,comment,,,"&lt;div class=""md""&gt;&lt;p&gt;The Palestinians are colonists who stayed long enough for people to forget they are colonists&lt;/p&gt;
&lt;/div&gt;",t1_k4qgdpr,,,,2,,t1_k44xm9b,,k4qgdpr,t3_172yh7w,2024-06-18T15:16:46.938Z,,,,3,https://www.reddit.com/r/TikTokCringe/comments/172yh7w/having_a_nuanced_view_of_the_israel_palestine/k4qgdpr/,,t2_177hom,GoldyTwatus,
