body,category,communityName,createdAt,dataType,description,flair,html,id,isAd,isVideo,numberOfComments,numberOfreplies,over18,parentId,parsedCommunityName,parsedId,postId,scrapedAt,thumbnailUrl,title,upVoteRatio,upVotes,url,userIcon,userId,username,videoUrl
"This community aims for respectful dialogue and debate, and our rules are focused on facilitating that. To align with rule 1, make every attempt to be polite in tone, charitable in your interpretations, fair in your arguments and patient in your explanations.

Don't debate the person, debate the argument; use terms towards a debate opponent that they or their relevant group(s) would self-identify with whenever possible. You may use negative characterizations towards a group in a specific context that distinguishes the negative characterization from the positive -- that means insulting opinions are allowed as a necessary part of an argument, but are prohibited in place of an argument.

Many of the issues in the I/P conflict boil down to personal moral beliefs; these should be calmly and politely explored. If you can't thoughtfully engage with a point of view, then don't engage with it at all.",IsraelPalestine,r/IsraelPalestine,2023-10-08T20:50:00.000Z,comment,,,"&lt;div class=""md""&gt;&lt;p&gt;This community aims for respectful dialogue and debate, and our rules are focused on facilitating that. To align with rule 1, make every attempt to be polite in tone, charitable in your interpretations, fair in your arguments and patient in your explanations.&lt;/p&gt;

&lt;p&gt;Don&amp;#39;t debate the person, debate the argument; use terms towards a debate opponent that they or their relevant group(s) would self-identify with whenever possible. You may use negative characterizations towards a group in a specific context that distinguishes the negative characterization from the positive -- that means insulting opinions are allowed as a necessary part of an argument, but are prohibited in place of an argument.&lt;/p&gt;

&lt;p&gt;Many of the issues in the I/P conflict boil down to personal moral beliefs; these should be calmly and politely explored. If you can&amp;#39;t thoughtfully engage with a point of view, then don&amp;#39;t engage with it at all.&lt;/p&gt;
&lt;/div&gt;",t1_k41hku4,,,,0,,t1_k41g2ru,,k41hku4,t3_172w9gt,2024-06-18T15:16:47.784Z,,,,6,https://www.reddit.com/r/IsraelPalestine/comments/172w9gt/i_have_changed_my_mind_about_the_israelpalestine/k41hku4/,,t2_rq8to8w4,IsraelPalestine-ModTeam,
Two wrongs don’t make a right,IsraelPalestine,r/IsraelPalestine,2023-10-08T20:42:40.000Z,comment,,,"&lt;div class=""md""&gt;&lt;p&gt;Two wrongs don’t make a right&lt;/p&gt;
&lt;/div&gt;",t1_k41gdvs,,,,0,,t1_k41g2ru,,k41gdvs,t3_172w9gt,2024-06-18T15:16:47.784Z,,,,4,https://www.reddit.com/r/IsraelPalestine/comments/172w9gt/i_have_changed_my_mind_about_the_israelpalestine/k41gdvs/,,t2_tjayek2t,ComparisonSea9247,
"https://reddit.com/r/PublicFreakout/s/0r8DMuD61t

Here is an example of what happens 

In this video you see an explosion on top of that building but notice the whole building didn’t come down. No major damage was done to the building. 

Why? 

Israel is shooting a warning shot meaning within a few minutes this whole building is going to be destroyed so any civilians should get the fuck out. 


As you can imagine if you’re a civilian in this situation you probably have shat your pants and have no idea what just happened. A few minutes to get out of this building while everyone is rushing out is difficult. You get out of your apartment and there are hundreds of people running down the stairs. 

You legit might not make it but some will and that’s why Israel sends the warning shot. 


In terms of the school yes they will target a school if Hamas is using that school to shoot missiles into Israel. 

This is the price of war and why it should be avoided at all costs.",TikTokCringe,r/TikTokCringe,2023-10-08T18:54:07.000Z,comment,,,"&lt;div class=""md""&gt;&lt;p&gt;&lt;a href=""https://reddit.com/r/PublicFreakout/s/0r8DMuD61t""&gt;https://reddit.com/r/PublicFreakout/s/0r8DMuD61t&lt;/a&gt;&lt;/p&gt;

&lt;p&gt;Here is an example of what happens &lt;/p&gt;

&lt;p&gt;In this video you see an explosion on top of that building but notice the whole building didn’t come down. No major damage was done to the building. &lt;/p&gt;

&lt;p&gt;Why? &lt;/p&gt;

&lt;p&gt;Israel is shooting a warning shot meaning within a few minutes this whole building is going to be destroyed so any civilians should get the fuck out. &lt;/p&gt;

&lt;p&gt;As you can imagine if you’re a civilian in this situation you probably have shat your pants and have no idea what just happened. A few minutes to get out of this building while everyone is rushing out is difficult. You get out of your apartment and there are hundreds of people running down the stairs. &lt;/p&gt;

&lt;p&gt;You legit might not make it but some will and that’s why Israel sends the warning shot. &lt;/p&gt;

&lt;p&gt;In terms of the school yes they will target a school if Hamas is using that school to shoot missiles into Israel. &lt;/p&gt;

&lt;p&gt;This is the price of war and why it should be avoided at all costs.&lt;/p&gt;
&lt;/div&gt;",t1_k40y5ax,,,,1,,t1_k40xfom,,k40y5ax,t3_172yh7w,2024-06-18T15:16:46.939Z,,,,4,https://www.reddit.com/r/TikTokCringe/comments/172yh7w/having_a_nuanced_view_of_the_israel_palestine/k40y5ax/,,t2_go07vpls,Charming_Cicada_7757,
"&gt; fuck

/u/PakLivTO. Please avoid using profanities to make a point or emphasis. [(Rule 2)](https://www.reddit.com/r/IsraelPalestine/wiki/rules/detailed-rules#wiki_2._no_profanity)


*I am a bot, and this action was performed automatically. Please [contact the moderators of this subreddit](/message/compose/?to=/r/IsraelPalestine) if you have any questions or concerns.*",IsraelPalestine,r/IsraelPalestine,2023-10-08T20:40:47.000Z,comment,,,"&lt;div class=""md""&gt;&lt;blockquote&gt;
&lt;p&gt;fuck&lt;/p&gt;
&lt;/blockquote&gt;

&lt;p&gt;&lt;a href=""/u/PakLivTO""&gt;/u/PakLivTO&lt;/a&gt;. Please avoid using profanities to make a point or emphasis. &lt;a href=""https://www.reddit.com/r/IsraelPalestine/wiki/rules/detailed-rules#wiki_2._no_profanity""&gt;(Rule 2)&lt;/a&gt;&lt;/p&gt;

&lt;p&gt;&lt;em&gt;I am a bot, and this action was performed automatically. Please &lt;a href=""/message/compose/?to=/r/IsraelPalestine""&gt;contact the moderators of this subreddit&lt;/a&gt; if you have any questions or concerns.&lt;/em&gt;&lt;/p&gt;
&lt;/div&gt;",t1_k41g2si,,,,0,,t1_k41g2ru,,k41g2si,t3_172w9gt,2024-06-18T15:16:47.784Z,,,,2,https://www.reddit.com/r/IsraelPalestine/comments/172w9gt/i_have_changed_my_mind_about_the_israelpalestine/k41g2si/,,t2_6l4z3,AutoModerator,
[removed],IsraelPalestine,r/IsraelPalestine,2023-10-08T20:40:40.000Z,comment,,,"&lt;div class=""md""&gt;&lt;p&gt;[removed]&lt;/p&gt;
&lt;/div&gt;",t1_k41g22e,,,,3,,t3_172w9gt,,k41g22e,t3_172w9gt,2024-06-18T15:16:47.784Z,,,,-9,https://www.reddit.com/r/IsraelPalestine/comments/172w9gt/i_have_changed_my_mind_about_the_israelpalestine/k41g22e/,,,[deleted],
"Some did, sure. There were MANY different tribes, with many different cultures. You cannot pretend they are all the same. 

We still get videos of sexually abusing prisoners, or the women on natives by military forces... We get them in the modern day, by American military. 

It absolutely happened by the colonizers to the Native Americans. 

We have torture against the enemy in every culture. We have slavery in many cultures. 

Hard to say that one cultures war mongering was worse than another's.

Edit: downvote me for saying that not all Native Americans were scalpers. Downvote me for saying that rape occurs in war. Downvote me for saying that you cannot equate all wars and the methods used. Still true, even if you want to believe your group are always heroes.

Also, specifically calling out scalping is an odd choice. There are stories of American troops scalping Nazis. It has a history in Europe and Asia.",TikTokCringe,r/TikTokCringe,2023-10-08T14:42:34.000Z,comment,,,"&lt;div class=""md""&gt;&lt;p&gt;Some did, sure. There were MANY different tribes, with many different cultures. You cannot pretend they are all the same. &lt;/p&gt;

&lt;p&gt;We still get videos of sexually abusing prisoners, or the women on natives by military forces... We get them in the modern day, by American military. &lt;/p&gt;

&lt;p&gt;It absolutely happened by the colonizers to the Native Americans. &lt;/p&gt;

&lt;p&gt;We have torture against the enemy in every culture. We have slavery in many cultures. &lt;/p&gt;

&lt;p&gt;Hard to say that one cultures war mongering was worse than another&amp;#39;s.&lt;/p&gt;

&lt;p&gt;Edit: downvote me for saying that not all Native Americans were scalpers. Downvote me for saying that rape occurs in war. Downvote me for saying that you cannot equate all wars and the methods used. Still true, even if you want to believe your group are always heroes.&lt;/p&gt;

&lt;p&gt;Also, specifically calling out scalping is an odd choice. There are stories of American troops scalping Nazis. It has a history in Europe and Asia.&lt;/p&gt;
&lt;/div&gt;",t1_k3zsa5d,,,,4,,t1_k3zppec,,k3zsa5d,t3_172yh7w,2024-06-18T15:16:46.939Z,,,,162,https://www.reddit.com/r/TikTokCringe/comments/172yh7w/having_a_nuanced_view_of_the_israel_palestine/k3zsa5d/,,t2_30s22g8f,vitaesbona1,
"This community aims for respectful dialogue and debate, and our rules are focused on facilitating that. To align with rule 1, make every attempt to be polite in tone, charitable in your interpretations, fair in your arguments and patient in your explanations.

Don't debate the person, debate the argument; use terms towards a debate opponent that they or their relevant group(s) would self-identify with whenever possible. You may use negative characterizations towards a group in a specific context that distinguishes the negative characterization from the positive -- that means insulting opinions are allowed as a necessary part of an argument, but are prohibited in place of an argument.

Many of the issues in the I/P conflict boil down to personal moral beliefs; these should be calmly and politely explored. If you can't thoughtfully engage with a point of view, then don't engage with it at all.",IsraelPalestine,r/IsraelPalestine,2023-10-09T00:05:36.000Z,comment,,,"&lt;div class=""md""&gt;&lt;p&gt;This community aims for respectful dialogue and debate, and our rules are focused on facilitating that. To align with rule 1, make every attempt to be polite in tone, charitable in your interpretations, fair in your arguments and patient in your explanations.&lt;/p&gt;

&lt;p&gt;Don&amp;#39;t debate the person, debate the argument; use terms towards a debate opponent that they or their relevant group(s) would self-identify with whenever possible. You may use negative characterizations towards a group in a specific context that distinguishes the negative characterization from the positive -- that means insulting opinions are allowed as a necessary part of an argument, but are prohibited in place of an argument.&lt;/p&gt;

&lt;p&gt;Many of the issues in the I/P conflict boil down to personal moral beliefs; these should be calmly and politely explored. If you can&amp;#39;t thoughtfully engage with a point of view, then don&amp;#39;t engage with it at all.&lt;/p&gt;
&lt;/div&gt;",t1_k42aoj9,,,,0,,t1_k41g22e,,k42aoj9,t3_172w9gt,2024-06-18T15:16:47.784Z,,,,2,https://www.reddit.com/r/IsraelPalestine/comments/172w9gt/i_have_changed_my_mind_about_the_israelpalestine/k42aoj9/,,t2_rq8to8w4,IsraelPalestine-ModTeam,
"Thats a fair point. Out of curiosity, whats your take on [This](https://reddit.com/r/Damnthatsinteresting/s/8dhUulc0TM)?",TikTokCringe,r/TikTokCringe,2023-10-08T14:47:08.000Z,comment,,,"&lt;div class=""md""&gt;&lt;p&gt;Thats a fair point. Out of curiosity, whats your take on &lt;a href=""https://reddit.com/r/Damnthatsinteresting/s/8dhUulc0TM""&gt;This&lt;/a&gt;?&lt;/p&gt;
&lt;/div&gt;",t1_k3zszld,,,,3,,t1_k3zsa5d,,k3zszld,t3_172yh7w,2024-06-18T15:16:46.939Z,,,,93,https://www.reddit.com/r/TikTokCringe/comments/172yh7w/having_a_nuanced_view_of_the_israel_palestine/k3zszld/,,t2_c4pbn,stupernan1,
https://www.reddit.com/r/2ndYomKippurWar/comments/173298l/video_of_a_wounded_filipino_worker_in_israel/,IsraelPalestine,r/IsraelPalestine,2023-10-08T20:44:57.000Z,comment,,,"&lt;div class=""md""&gt;&lt;p&gt;&lt;a href=""https://www.reddit.com/r/2ndYomKippurWar/comments/173298l/video_of_a_wounded_filipino_worker_in_israel/""&gt;https://www.reddit.com/r/2ndYomKippurWar/comments/173298l/video_of_a_wounded_filipino_worker_in_israel/&lt;/a&gt;&lt;/p&gt;
&lt;/div&gt;",t1_k41gr67,,,,0,,t1_k41g22e,,k41gr67,t3_172w9gt,2024-06-18T15:16:47.784Z,,,,9,https://www.reddit.com/r/IsraelPalestine/comments/172w9gt/i_have_changed_my_mind_about_the_israelpalestine/k41gr67/,,t2_vo0t0ij8,Haunting_Ad_4945,
Convenient that that starts right after the 2nd Antifada...  just sayin.,TikTokCringe,r/TikTokCringe,2023-10-09T05:54:00.000Z,comment,,,"&lt;div class=""md""&gt;&lt;p&gt;Convenient that that starts right after the 2nd Antifada...  just sayin.&lt;/p&gt;
&lt;/div&gt;",t1_k43gty0,,,,0,,t1_k3zszld,,k43gty0,t3_172yh7w,2024-06-18T15:16:46.939Z,,,,3,https://www.reddit.com/r/TikTokCringe/comments/172yh7w/having_a_nuanced_view_of_the_israel_palestine/k43gty0/,,t2_2rgxyyvs,ArbreCadabra,
Do you ask for your food to be chewed for you? It's all over reddit.. if you open your eyes.,IsraelPalestine,r/IsraelPalestine,2023-10-08T20:43:55.000Z,comment,,,"&lt;div class=""md""&gt;&lt;p&gt;Do you ask for your food to be chewed for you? It&amp;#39;s all over reddit.. if you open your eyes.&lt;/p&gt;
&lt;/div&gt;",t1_k41gl4z,,,,0,,t1_k41g22e,,k41gl4z,t3_172w9gt,2024-06-18T15:16:47.784Z,,,,14,https://www.reddit.com/r/IsraelPalestine/comments/172w9gt/i_have_changed_my_mind_about_the_israelpalestine/k41gl4z/,,t2_6wmj25k,geekasso,
They don’t like this pic because it shows the real victim,TikTokCringe,r/TikTokCringe,2023-10-08T15:04:35.000Z,comment,,,"&lt;div class=""md""&gt;&lt;p&gt;They don’t like this pic because it shows the real victim&lt;/p&gt;
&lt;/div&gt;",t1_k3zvp5f,,,,1,,t1_k3zszld,,k3zvp5f,t3_172yh7w,2024-06-18T15:16:46.939Z,,,,46,https://www.reddit.com/r/TikTokCringe/comments/172yh7w/having_a_nuanced_view_of_the_israel_palestine/k3zvp5f/,,t2_geo60,BryanAbbo,
"Mind, scalping in the US was introduced by Europeans as a means of providing proof of a slain Native American for bounty.",TikTokCringe,r/TikTokCringe,2023-10-08T15:49:55.000Z,comment,,,"&lt;div class=""md""&gt;&lt;p&gt;Mind, scalping in the US was introduced by Europeans as a means of providing proof of a slain Native American for bounty.&lt;/p&gt;
&lt;/div&gt;",t1_k402tjc,,,,2,,t1_k3zsa5d,,k402tjc,t3_172yh7w,2024-06-18T15:16:46.939Z,,,,12,https://www.reddit.com/r/TikTokCringe/comments/172yh7w/having_a_nuanced_view_of_the_israel_palestine/k402tjc/,,t2_990du,Warrior_Runding,
"No. These particular incidents by Hamas are horrific and unjustified where the killings of women and children are concerned, but they're not ""unprovoked."" Years of ethnic cleansing, blockade, pogroms on Palestinian towns, desecration of Palestinian sacred sites, daily raids into Palestinian homes, bulldozing of Palestinian homes for illegal settler fanatics, constant humiliation and degradation of an entire people, continuous kidnappings and killings of Palestinian children from babies through teens.

The cause of a Free Palestine remains right and just.",IsraelPalestine,r/IsraelPalestine,2023-10-08T20:39:55.000Z,comment,,,"&lt;div class=""md""&gt;&lt;p&gt;No. These particular incidents by Hamas are horrific and unjustified where the killings of women and children are concerned, but they&amp;#39;re not &amp;quot;unprovoked.&amp;quot; Years of ethnic cleansing, blockade, pogroms on Palestinian towns, desecration of Palestinian sacred sites, daily raids into Palestinian homes, bulldozing of Palestinian homes for illegal settler fanatics, constant humiliation and degradation of an entire people, continuous kidnappings and killings of Palestinian children from babies through teens.&lt;/p&gt;

&lt;p&gt;The cause of a Free Palestine remains right and just.&lt;/p&gt;
&lt;/div&gt;",t1_k41fxqx,,,,0,,t3_172w9gt,,k41fxqx,t3_172w9gt,2024-06-18T15:16:47.784Z,,,,-7,https://www.reddit.com/r/IsraelPalestine/comments/172w9gt/i_have_changed_my_mind_about_the_israelpalestine/k41fxqx/,,t2_kswc2rgy,somewordthing,
"I am certainly no expert on scalping, or Native American history. I was fairly sure it was independently developed in the Americas and Europe/Asia, I hadn't heard that it was brought by Europeans. It would be interesting to me if it was, though. 

It would be like horses. Every depiction of Native Americans have them riding horses, and few learn that they were brought by the settlers.",TikTokCringe,r/TikTokCringe,2023-10-08T15:57:28.000Z,comment,,,"&lt;div class=""md""&gt;&lt;p&gt;I am certainly no expert on scalping, or Native American history. I was fairly sure it was independently developed in the Americas and Europe/Asia, I hadn&amp;#39;t heard that it was brought by Europeans. It would be interesting to me if it was, though. &lt;/p&gt;

&lt;p&gt;It would be like horses. Every depiction of Native Americans have them riding horses, and few learn that they were brought by the settlers.&lt;/p&gt;
&lt;/div&gt;",t1_k404103,,,,0,,t1_k402tjc,,k404103,t3_172yh7w,2024-06-18T15:16:46.939Z,,,,17,https://www.reddit.com/r/TikTokCringe/comments/172yh7w/having_a_nuanced_view_of_the_israel_palestine/k404103/,,t2_30s22g8f,vitaesbona1,
"I am relieved you have come to your senses. I must add that Nice People like you with your sensibilities and misinterpretations have helped give the Palestinians the appearance of morality that encouraged them to commit the acts (and make the stuff films) that you now deplore. It’s good you’re with us, but the poor,poor Palestinians theme is getting a lot of Israeli civilians killed. 

I have always had doubts about policies, not people. These people are mine.",IsraelPalestine,r/IsraelPalestine,2023-10-08T20:39:51.000Z,comment,,,"&lt;div class=""md""&gt;&lt;p&gt;I am relieved you have come to your senses. I must add that Nice People like you with your sensibilities and misinterpretations have helped give the Palestinians the appearance of morality that encouraged them to commit the acts (and make the stuff films) that you now deplore. It’s good you’re with us, but the poor,poor Palestinians theme is getting a lot of Israeli civilians killed. &lt;/p&gt;

&lt;p&gt;I have always had doubts about policies, not people. These people are mine.&lt;/p&gt;
&lt;/div&gt;",t1_k41fxdr,,,,0,,t3_172w9gt,,k41fxdr,t3_172w9gt,2024-06-18T15:16:47.784Z,,,,38,https://www.reddit.com/r/IsraelPalestine/comments/172w9gt/i_have_changed_my_mind_about_the_israelpalestine/k41fxdr/,,t2_j0deshgg,SusanMShwartz,
Something that the guy in the video clearly doesn’t understand. He refers to the “Native American one” as if there was a single culture in pre-Colombian America.,TikTokCringe,r/TikTokCringe,2023-10-09T11:54:03.000Z,comment,,,"&lt;div class=""md""&gt;&lt;p&gt;Something that the guy in the video clearly doesn’t understand. He refers to the “Native American one” as if there was a single culture in pre-Colombian America.&lt;/p&gt;
&lt;/div&gt;",t1_k44a82y,,,,0,,t1_k3zsa5d,,k44a82y,t3_172yh7w,2024-06-18T15:16:46.939Z,,,,2,https://www.reddit.com/r/TikTokCringe/comments/172yh7w/having_a_nuanced_view_of_the_israel_palestine/k44a82y/,,t2_119rr7jb,mh985,
Took you long enough…,IsraelPalestine,r/IsraelPalestine,2023-10-08T20:39:11.000Z,comment,,,"&lt;div class=""md""&gt;&lt;p&gt;Took you long enough…&lt;/p&gt;
&lt;/div&gt;",t1_k41fthk,,,,0,,t3_172w9gt,,k41fthk,t3_172w9gt,2024-06-18T15:16:47.784Z,,,,13,https://www.reddit.com/r/IsraelPalestine/comments/172w9gt/i_have_changed_my_mind_about_the_israelpalestine/k41fthk/,,t2_84jf6,Legend117,
"No, I've always supported freedom for Palestine but I've never supported Hamas. They are a reactionary Islamist group. You shouldn't ditch your support just because of Hamas.",IsraelPalestine,r/IsraelPalestine,2023-10-08T20:39:04.000Z,comment,,,"&lt;div class=""md""&gt;&lt;p&gt;No, I&amp;#39;ve always supported freedom for Palestine but I&amp;#39;ve never supported Hamas. They are a reactionary Islamist group. You shouldn&amp;#39;t ditch your support just because of Hamas.&lt;/p&gt;
&lt;/div&gt;",t1_k41fsrt,,,,0,,t3_172w9gt,,k41fsrt,t3_172w9gt,2024-06-18T15:16:47.784Z,,,,20,https://www.reddit.com/r/IsraelPalestine/comments/172w9gt/i_have_changed_my_mind_about_the_israelpalestine/k41fsrt/,,t2_k2nxyq33,ThatAnarchist161,
"In all honesty, it's easy to say this when you haven't lost people. I'm a parent. If someone hurt my children and was protected by every institution I'm supposed to rely on for justice, whose to say that I won't hurt that person's family. Pain and suffering tears a person down so much that no longer see the humanity in others. These atrocities will continue but this is monster Israel made",TikTokCringe,r/TikTokCringe,2023-10-08T15:18:29.000Z,comment,,,"&lt;div class=""md""&gt;&lt;p&gt;In all honesty, it&amp;#39;s easy to say this when you haven&amp;#39;t lost people. I&amp;#39;m a parent. If someone hurt my children and was protected by every institution I&amp;#39;m supposed to rely on for justice, whose to say that I won&amp;#39;t hurt that person&amp;#39;s family. Pain and suffering tears a person down so much that no longer see the humanity in others. These atrocities will continue but this is monster Israel made&lt;/p&gt;
&lt;/div&gt;",t1_k3zxu2e,,,,0,,t1_k3zkvls,,k3zxu2e,t3_172yh7w,2024-06-18T15:16:46.939Z,,,,51,https://www.reddit.com/r/TikTokCringe/comments/172yh7w/having_a_nuanced_view_of_the_israel_palestine/k3zxu2e/,,t2_w8ew6td7,imgonnagetcha88,
I have no sympathy for murderers,IsraelPalestine,r/IsraelPalestine,2023-10-08T20:38:40.000Z,comment,,,"&lt;div class=""md""&gt;&lt;p&gt;I have no sympathy for murderers&lt;/p&gt;
&lt;/div&gt;",t1_k41fqh8,,,,0,,t3_172w9gt,,k41fqh8,t3_172w9gt,2024-06-18T15:16:47.784Z,,,,14,https://www.reddit.com/r/IsraelPalestine/comments/172w9gt/i_have_changed_my_mind_about_the_israelpalestine/k41fqh8/,,t2_bjpfy5c,ponyhidden,
Hasn’t Israel been targeting civilians in Gaza for years now? That’s what an occupation force does.,TikTokCringe,r/TikTokCringe,2023-10-08T14:57:11.000Z,comment,,,"&lt;div class=""md""&gt;&lt;p&gt;Hasn’t Israel been targeting civilians in Gaza for years now? That’s what an occupation force does.&lt;/p&gt;
&lt;/div&gt;",t1_k3zujlc,,,,2,,t1_k3zkvls,,k3zujlc,t3_172yh7w,2024-06-18T15:16:46.939Z,,,,46,https://www.reddit.com/r/TikTokCringe/comments/172yh7w/having_a_nuanced_view_of_the_israel_palestine/k3zujlc/,,t2_xl7cj,OGCASHforGOLD,
[removed],IsraelPalestine,r/IsraelPalestine,2023-10-08T20:38:18.000Z,comment,,,"&lt;div class=""md""&gt;&lt;p&gt;[removed]&lt;/p&gt;
&lt;/div&gt;",t1_k41fo8s,,,,1,,t3_172w9gt,,k41fo8s,t3_172w9gt,2024-06-18T15:16:47.784Z,,,,-6,https://www.reddit.com/r/IsraelPalestine/comments/172w9gt/i_have_changed_my_mind_about_the_israelpalestine/k41fo8s/,,,[deleted],
HAMAS has been using civillians as body shields.,TikTokCringe,r/TikTokCringe,2023-10-08T18:13:01.000Z,comment,,,"&lt;div class=""md""&gt;&lt;p&gt;HAMAS has been using civillians as body shields.&lt;/p&gt;
&lt;/div&gt;",t1_k40r3mz,,,,1,,t1_k3zujlc,,k40r3mz,t3_172yh7w,2024-06-18T15:16:46.939Z,,,,10,https://www.reddit.com/r/TikTokCringe/comments/172yh7w/having_a_nuanced_view_of_the_israel_palestine/k40r3mz/,,t2_1nsvcba,NotDuckie,
This has been removed for breaking the Reddit Content Policy.,IsraelPalestine,r/IsraelPalestine,2023-10-08T23:29:03.000Z,comment,,,"&lt;div class=""md""&gt;&lt;p&gt;This has been removed for breaking the Reddit Content Policy.&lt;/p&gt;
&lt;/div&gt;",t1_k425njb,,,,0,,t1_k41fo8s,,k425njb,t3_172w9gt,2024-06-18T15:16:47.784Z,,,,1,https://www.reddit.com/r/IsraelPalestine/comments/172w9gt/i_have_changed_my_mind_about_the_israelpalestine/k425njb/,,t2_rq8to8w4,IsraelPalestine-ModTeam,
Palestinian militants committing those crimes against civilians is shocking and wrong but unfortunately it's another horrid consequence of what happens when you subject a group of people to a colonial nightmare for over a century.,TikTokCringe,r/TikTokCringe,2023-10-08T14:37:47.000Z,comment,,,"&lt;div class=""md""&gt;&lt;p&gt;Palestinian militants committing those crimes against civilians is shocking and wrong but unfortunately it&amp;#39;s another horrid consequence of what happens when you subject a group of people to a colonial nightmare for over a century.&lt;/p&gt;
&lt;/div&gt;",t1_k3zrjwu,,,,3,,t1_k3zkvls,,k3zrjwu,t3_172yh7w,2024-06-18T15:16:46.939Z,,,,68,https://www.reddit.com/r/TikTokCringe/comments/172yh7w/having_a_nuanced_view_of_the_israel_palestine/k3zrjwu/,,t2_eosxfnc,macnams,
[deleted],TikTokCringe,r/TikTokCringe,2023-10-08T16:42:51.000Z,comment,,,"&lt;div class=""md""&gt;&lt;p&gt;[deleted]&lt;/p&gt;
&lt;/div&gt;",t1_k40bmvo,,,,2,,t1_k3zrjwu,,k40bmvo,t3_172yh7w,2024-06-18T15:16:46.939Z,,,,46,https://www.reddit.com/r/TikTokCringe/comments/172yh7w/having_a_nuanced_view_of_the_israel_palestine/k40bmvo/,,,[deleted],
[removed],IsraelPalestine,r/IsraelPalestine,2023-10-08T20:38:06.000Z,comment,,,"&lt;div class=""md""&gt;&lt;p&gt;[removed]&lt;/p&gt;
&lt;/div&gt;",t1_k41fn2u,,,,0,,t3_172w9gt,,k41fn2u,t3_172w9gt,2024-06-18T15:16:47.784Z,,,,-8,https://www.reddit.com/r/IsraelPalestine/comments/172w9gt/i_have_changed_my_mind_about_the_israelpalestine/k41fn2u/,,,[deleted],
